{
  "schema_version": "core_reference_v0.1",
  "complex_id": "2026000282",
  "source": {
    "pdf_filename": "2026000282_3.pdf",
    "text_filename": "2026000282_3.txt",
    "pdf_sha256": "a0a199d1a63c68d8a9439483decac6f7f0af7a95e4c86eaeab18dbe2009ca9dd",
    "page_count": 75
  },
  "review": {
    "text_source_review": "COMPLETE",
    "pdf_visual_review": "COMPLETE",
    "scope": "DOCUMENT_LEVEL_CORE",
    "excluded_fields": {
      "unit_specific_amounts": "NOT_LABELED_UNIT_REQUIRED",
      "additional_costs": "NOT_LABELED_UNIT_REQUIRED",
      "bank_names": "NOT_LABELED_EXPLICIT_LOAN_BANK_REQUIRED",
      "guarantee_provider": "NOT_LABELED_EXPLICIT_PROVIDER_REQUIRED"
    },
    "notes": []
  },
  "labels": {
    "payment_schedule": {
      "down_payment_ratio": {
        "value": 0.05,
        "verification": "VERIFIED_TEXT",
        "evidence": [
          {
            "page": 6,
            "raw_text": "계약금(5%) 중도금(60%) 잔금(35%)"
          }
        ]
      },
      "interim_payment_ratio": {
        "value": 0.6,
        "verification": "VERIFIED_TEXT",
        "evidence": [
          {
            "page": 6,
            "raw_text": "계약금(5%) 중도금(60%) 잔금(35%)"
          }
        ]
      },
      "balance_payment_ratio": {
        "value": 0.35,
        "verification": "VERIFIED_TEXT",
        "evidence": [
          {
            "page": 6,
            "raw_text": "계약금(5%) 중도금(60%) 잔금(35%)"
          }
        ]
      },
      "interim_installments": {
        "value": [
          {
            "number": 1,
            "ratio": 0.1,
            "due_date": "2027-02-01"
          },
          {
            "number": 2,
            "ratio": 0.1,
            "due_date": "2027-07-01"
          },
          {
            "number": 3,
            "ratio": 0.1,
            "due_date": "2028-01-03"
          },
          {
            "number": 4,
            "ratio": 0.1,
            "due_date": "2028-07-03"
          },
          {
            "number": 5,
            "ratio": 0.1,
            "due_date": "2028-11-01"
          },
          {
            "number": 6,
            "ratio": 0.1,
            "due_date": "2029-03-02"
          }
        ],
        "verification": "VERIFIED_NORMALIZED",
        "evidence": [
          {
            "page": 6,
            "raw_text": "2027-02-01"
          },
          {
            "page": 6,
            "raw_text": "2027-07-01"
          },
          {
            "page": 6,
            "raw_text": "2028-01-03"
          },
          {
            "page": 6,
            "raw_text": "2028-07-03"
          },
          {
            "page": 6,
            "raw_text": "2028-11-01"
          },
          {
            "page": 6,
            "raw_text": "2029-03-02"
          }
        ]
      },
      "balance_due_text": {
        "value": "입주지정일",
        "verification": "VERIFIED_NORMALIZED",
        "evidence": [
          {
            "page": 6,
            "raw_text": "입주지정일"
          }
        ]
      },
      "move_in_month": {
        "value": "2029-08",
        "verification": "VERIFIED_NORMALIZED",
        "evidence": [
          {
            "page": 5,
            "raw_text": "입주시기 : 2029년 08월 예정"
          }
        ]
      }
    },
    "interim_loan": {
      "arrangement_status": {
        "value": "PLANNED",
        "verification": "VERIFIED_NORMALIZED",
        "evidence": [
          {
            "page": 39,
            "raw_text": "중도금 대출을 통해 중도금을 납입할 수 있으나"
          }
        ]
      },
      "arranged_ratio": {
        "value": 0.6,
        "verification": "VERIFIED_TEXT",
        "evidence": [
          {
            "page": 39,
            "raw_text": "전체 공급대금의 60% 범위 내에서 시행할 예정"
          }
        ]
      },
      "self_funding_ratio": {
        "value": 0,
        "verification": "VERIFIED_DERIVED",
        "evidence": [
          {
            "page": 6,
            "raw_text": "계약금(5%) 중도금(60%) 잔금(35%)"
          },
          {
            "page": 39,
            "raw_text": "전체 공급대금의 60% 범위 내에서 시행할 예정"
          }
        ]
      },
      "interest_type": {
        "value": "DEFERRED_INTEREST",
        "verification": "VERIFIED_TEXT",
        "evidence": [
          {
            "page": 39,
            "raw_text": "중도금 무이자"
          },
          {
            "page": 39,
            "raw_text": "계약자는 입주시 사업주체에서 지정한 기일 내에 사업주체가 대납한 중도금 대출이자 등을 일시 납부하여야하며"
          }
        ]
      },
      "prepay_requirement_ratio": {
        "value": 0.05,
        "verification": "VERIFIED_TEXT",
        "evidence": [
          {
            "page": 39,
            "raw_text": "분양대금의 총 5% 완납 후"
          }
        ]
      }
    }
  }
}
