{
  "schema_version": "core_reference_v0.1",
  "complex_id": "2026000291",
  "source": {
    "pdf_filename": "2026000291_3.pdf",
    "text_filename": "2026000291_3.txt",
    "pdf_sha256": "65590f5b3582c25a3ab8164593f9e11ec12378056447205ca83ec9eebed51c68",
    "page_count": 63
  },
  "review": {
    "text_source_review": "COMPLETE",
    "pdf_visual_review": "COMPLETE",
    "scope": "DOCUMENT_LEVEL_CORE",
    "excluded_fields": {
      "unit_specific_amounts": "NOT_LABELED_UNIT_REQUIRED",
      "additional_costs": "NOT_LABELED_UNIT_REQUIRED",
      "bank_names": "NOT_LABELED_EXPLICIT_LOAN_BANK_REQUIRED",
      "guarantee_provider": "NOT_LABELED_EXPLICIT_PROVIDER_REQUIRED"
    },
    "notes": []
  },
  "labels": {
    "payment_schedule": {
      "down_payment_ratio": {
        "value": 0.05,
        "verification": "VERIFIED_TEXT",
        "evidence": [
          {
            "page": 8,
            "raw_text": "계약금 (5%) 중도금 (60%) 잔금 (35%)"
          }
        ]
      },
      "interim_payment_ratio": {
        "value": 0.6,
        "verification": "VERIFIED_TEXT",
        "evidence": [
          {
            "page": 8,
            "raw_text": "계약금 (5%) 중도금 (60%) 잔금 (35%)"
          }
        ]
      },
      "balance_payment_ratio": {
        "value": 0.35,
        "verification": "VERIFIED_TEXT",
        "evidence": [
          {
            "page": 8,
            "raw_text": "계약금 (5%) 중도금 (60%) 잔금 (35%)"
          }
        ]
      },
      "interim_installments": {
        "value": [
          {
            "number": 1,
            "ratio": 0.1,
            "due_date": "2027-01-15"
          },
          {
            "number": 2,
            "ratio": 0.1,
            "due_date": "2027-07-15"
          },
          {
            "number": 3,
            "ratio": 0.1,
            "due_date": "2028-01-17"
          },
          {
            "number": 4,
            "ratio": 0.1,
            "due_date": "2028-07-17"
          },
          {
            "number": 5,
            "ratio": 0.1,
            "due_date": "2028-12-15"
          },
          {
            "number": 6,
            "ratio": 0.1,
            "due_date": "2029-05-15"
          }
        ],
        "verification": "VERIFIED_NORMALIZED",
        "evidence": [
          {
            "page": 8,
            "raw_text": "2027.01.15"
          },
          {
            "page": 8,
            "raw_text": "2027.07.15"
          },
          {
            "page": 8,
            "raw_text": "2028.01.17"
          },
          {
            "page": 8,
            "raw_text": "2028.07.17"
          },
          {
            "page": 8,
            "raw_text": "2028.12.15"
          },
          {
            "page": 8,
            "raw_text": "2029.05.15"
          }
        ]
      },
      "balance_due_text": {
        "value": "입주지정기간",
        "verification": "VERIFIED_NORMALIZED",
        "evidence": [
          {
            "page": 8,
            "raw_text": "지정기간"
          }
        ]
      },
      "move_in_month": {
        "value": "2029-09",
        "verification": "VERIFIED_NORMALIZED",
        "evidence": [
          {
            "page": 6,
            "raw_text": "입주시기 : 2029년 09월 예정"
          }
        ]
      }
    },
    "interim_loan": {
      "arrangement_status": {
        "value": "PLANNED",
        "verification": "VERIFIED_NORMALIZED",
        "evidence": [
          {
            "page": 41,
            "raw_text": "대출관련 세부내용은 견본주택에서 별도 공지 및 안내 예정"
          }
        ]
      },
      "arranged_ratio": {
        "value": 0.6,
        "verification": "VERIFIED_TEXT",
        "evidence": [
          {
            "page": 41,
            "raw_text": "총 공급금액 중 60% 이내 중도금에 대하여"
          }
        ]
      },
      "self_funding_ratio": {
        "value": 0,
        "verification": "VERIFIED_DERIVED",
        "evidence": [
          {
            "page": 8,
            "raw_text": "계약금 (5%) 중도금 (60%) 잔금 (35%)"
          },
          {
            "page": 41,
            "raw_text": "총 공급금액 중 60% 이내 중도금에 대하여"
          }
        ]
      },
      "interest_type": {
        "value": "INTEREST_FREE",
        "verification": "VERIFIED_NORMALIZED",
        "evidence": [
          {
            "page": 41,
            "raw_text": "중도금 무이자 조건"
          }
        ]
      },
      "prepay_requirement_ratio": {
        "value": 0.05,
        "verification": "VERIFIED_TEXT",
        "evidence": [
          {
            "page": 41,
            "raw_text": "분양대금의 5% 납입 시 중도금 대출을 실행"
          }
        ]
      }
    }
  }
}
