{
  "schema_version": "core_reference_v0.1",
  "complex_id": "2026000293",
  "source": {
    "pdf_filename": "2026000293_3.pdf",
    "text_filename": "2026000293_3.txt",
    "pdf_sha256": "854050229458698ee7e15b7453cc93a4e35ce3a07300dabcb7a708551d3e1983",
    "page_count": 61
  },
  "review": {
    "text_source_review": "COMPLETE",
    "pdf_visual_review": "COMPLETE",
    "scope": "DOCUMENT_LEVEL_CORE",
    "excluded_fields": {
      "unit_specific_amounts": "NOT_LABELED_UNIT_REQUIRED",
      "additional_costs": "NOT_LABELED_UNIT_REQUIRED",
      "bank_names": "NOT_LABELED_EXPLICIT_LOAN_BANK_REQUIRED",
      "guarantee_provider": "NOT_LABELED_EXPLICIT_PROVIDER_REQUIRED"
    },
    "notes": []
  },
  "labels": {
    "payment_schedule": {
      "down_payment_ratio": {
        "value": 0.1,
        "verification": "VERIFIED_TEXT",
        "evidence": [
          {
            "page": 9,
            "raw_text": "계약금(10%) 중도금(60%) 잔금"
          }
        ]
      },
      "interim_payment_ratio": {
        "value": 0.6,
        "verification": "VERIFIED_TEXT",
        "evidence": [
          {
            "page": 9,
            "raw_text": "계약금(10%) 중도금(60%) 잔금"
          }
        ]
      },
      "balance_payment_ratio": {
        "value": 0.3,
        "verification": "VERIFIED_TEXT",
        "evidence": [
          {
            "page": 9,
            "raw_text": "계약금(10%) 중도금(60%) 잔금"
          }
        ]
      },
      "interim_installments": {
        "value": [
          {
            "number": 1,
            "ratio": 0.1,
            "due_date": "2027-02-25"
          },
          {
            "number": 2,
            "ratio": 0.1,
            "due_date": "2027-08-25"
          },
          {
            "number": 3,
            "ratio": 0.1,
            "due_date": "2028-02-25"
          },
          {
            "number": 4,
            "ratio": 0.1,
            "due_date": "2028-08-25"
          },
          {
            "number": 5,
            "ratio": 0.1,
            "due_date": "2029-02-23"
          },
          {
            "number": 6,
            "ratio": 0.1,
            "due_date": "2029-08-24"
          }
        ],
        "verification": "VERIFIED_NORMALIZED",
        "evidence": [
          {
            "page": 9,
            "raw_text": "27.02.25."
          },
          {
            "page": 9,
            "raw_text": "27.08.25."
          },
          {
            "page": 9,
            "raw_text": "28.02.25."
          },
          {
            "page": 9,
            "raw_text": "28.08.25."
          },
          {
            "page": 9,
            "raw_text": "29.02.23."
          },
          {
            "page": 9,
            "raw_text": "29.08.24."
          }
        ]
      },
      "balance_due_text": {
        "value": "입주지정일",
        "verification": "VERIFIED_NORMALIZED",
        "evidence": [
          {
            "page": 9,
            "raw_text": "지정일"
          }
        ]
      },
      "move_in_month": {
        "value": "2029-09",
        "verification": "VERIFIED_NORMALIZED",
        "evidence": [
          {
            "page": 7,
            "raw_text": "입주시기 : 2029년 09월 예정"
          }
        ]
      }
    },
    "interim_loan": {
      "arrangement_status": {
        "value": "PLANNED",
        "verification": "VERIFIED_NORMALIZED",
        "evidence": [
          {
            "page": 30,
            "raw_text": "계약자와 금융기관 간의 중도금 대출 알선을 제공할 예정"
          }
        ]
      },
      "arranged_ratio": {
        "value": 0.6,
        "verification": "VERIFIED_TEXT",
        "evidence": [
          {
            "page": 31,
            "raw_text": "전체 공급대금의 중도금 60% 범위 내에서 시행할 예정"
          }
        ]
      },
      "self_funding_ratio": {
        "value": 0,
        "verification": "VERIFIED_DERIVED",
        "evidence": [
          {
            "page": 9,
            "raw_text": "계약금(10%) 중도금(60%) 잔금"
          },
          {
            "page": 31,
            "raw_text": "전체 공급대금의 중도금 60% 범위 내에서 시행할 예정"
          }
        ]
      },
      "interest_type": {
        "value": "DEFERRED_INTEREST",
        "verification": "VERIFIED_NORMALIZED",
        "evidence": [
          {
            "page": 31,
            "raw_text": "중도금 이자후불제"
          }
        ]
      },
      "prepay_requirement_ratio": {
        "value": 0.1,
        "verification": "VERIFIED_DERIVED",
        "evidence": [
          {
            "page": 30,
            "raw_text": "계약금 1차 및 계약금 2차 완납 후"
          },
          {
            "page": 9,
            "raw_text": "계약금(10%) 중도금(60%) 잔금"
          }
        ]
      }
    }
  }
}
