{
  "schema_version": "core_reference_v0.1",
  "complex_id": "2026000312",
  "source": {
    "pdf_filename": "2026000312_2.pdf",
    "text_filename": "2026000312_2.txt",
    "pdf_sha256": "880cd8f4a5636eb44894af2fcf548583f0a71818071dd5a23a34dfd7a425aa8e",
    "page_count": 76
  },
  "review": {
    "text_source_review": "COMPLETE",
    "pdf_visual_review": "COMPLETE",
    "scope": "DOCUMENT_LEVEL_CORE",
    "excluded_fields": {
      "unit_specific_amounts": "NOT_LABELED_UNIT_REQUIRED",
      "additional_costs": "NOT_LABELED_UNIT_REQUIRED",
      "bank_names": "NOT_LABELED_EXPLICIT_LOAN_BANK_REQUIRED",
      "guarantee_provider": "NOT_LABELED_EXPLICIT_PROVIDER_REQUIRED"
    },
    "notes": []
  },
  "labels": {
    "payment_schedule": {
      "down_payment_ratio": {
        "value": 0.1,
        "verification": "VERIFIED_TEXT",
        "evidence": [
          {
            "page": 8,
            "raw_text": "계약금(10%) 중도금(60%) 잔금"
          }
        ]
      },
      "interim_payment_ratio": {
        "value": 0.6,
        "verification": "VERIFIED_TEXT",
        "evidence": [
          {
            "page": 8,
            "raw_text": "계약금(10%) 중도금(60%) 잔금"
          }
        ]
      },
      "balance_payment_ratio": {
        "value": 0.3,
        "verification": "VERIFIED_TEXT",
        "evidence": [
          {
            "page": 8,
            "raw_text": "계약금(10%) 중도금(60%) 잔금"
          }
        ]
      },
      "interim_installments": {
        "value": [
          {
            "number": 1,
            "ratio": 0.1,
            "due_date": "2026-12-07"
          },
          {
            "number": 2,
            "ratio": 0.1,
            "due_date": "2027-07-08"
          },
          {
            "number": 3,
            "ratio": 0.1,
            "due_date": "2028-01-07"
          },
          {
            "number": 4,
            "ratio": 0.1,
            "due_date": "2028-06-07"
          },
          {
            "number": 5,
            "ratio": 0.1,
            "due_date": "2028-09-07"
          },
          {
            "number": 6,
            "ratio": 0.1,
            "due_date": "2028-12-07"
          }
        ],
        "verification": "VERIFIED_NORMALIZED",
        "evidence": [
          {
            "page": 8,
            "raw_text": "26.12.07."
          },
          {
            "page": 8,
            "raw_text": "27.07.08."
          },
          {
            "page": 8,
            "raw_text": "28.01.07."
          },
          {
            "page": 8,
            "raw_text": "28.06.07."
          },
          {
            "page": 8,
            "raw_text": "28.09.07."
          },
          {
            "page": 8,
            "raw_text": "28.12.07."
          }
        ]
      },
      "balance_due_text": {
        "value": "입주지정일",
        "verification": "VERIFIED_NORMALIZED",
        "evidence": [
          {
            "page": 8,
            "raw_text": "지정일"
          }
        ]
      },
      "move_in_month": {
        "value": "2029-03",
        "verification": "VERIFIED_NORMALIZED",
        "evidence": [
          {
            "page": 7,
            "raw_text": "입주시기 : 2029년 3월 예정"
          }
        ]
      }
    },
    "interim_loan": {
      "arrangement_status": {
        "value": "PLANNED",
        "verification": "VERIFIED_NORMALIZED",
        "evidence": [
          {
            "page": 46,
            "raw_text": "사업주체 또는 시공사가 지정하는 대출취급기관에서 대출이 가능"
          }
        ]
      },
      "arranged_ratio": {
        "value": 0.6,
        "verification": "VERIFIED_TEXT",
        "evidence": [
          {
            "page": 46,
            "raw_text": "총 분양대금의 60% 범위 내에서"
          }
        ]
      },
      "self_funding_ratio": {
        "value": 0,
        "verification": "VERIFIED_DERIVED",
        "evidence": [
          {
            "page": 8,
            "raw_text": "계약금(10%) 중도금(60%) 잔금"
          },
          {
            "page": 46,
            "raw_text": "총 분양대금의 60% 범위 내에서"
          }
        ]
      },
      "interest_type": {
        "value": "INTEREST_FREE",
        "verification": "VERIFIED_NORMALIZED",
        "evidence": [
          {
            "page": 46,
            "raw_text": "중도금 대출은 무이자 조건"
          }
        ]
      },
      "prepay_requirement_ratio": {
        "value": 0.1,
        "verification": "VERIFIED_TEXT",
        "evidence": [
          {
            "page": 46,
            "raw_text": "계약금(공급가액의 10%) 완납이후"
          }
        ]
      }
    }
  }
}
