{
  "schema_version": "core_reference_v0.1",
  "complex_id": "2026000295",
  "source": {
    "pdf_filename": "2026000295_8.pdf",
    "text_filename": "2026000295_8.txt",
    "pdf_sha256": "441c1daaa49824db03d546647f3fbbb96cd583d2b8bab58679e8c3723829ea85",
    "page_count": 69
  },
  "review": {
    "text_source_review": "COMPLETE",
    "pdf_visual_review": "COMPLETE",
    "scope": "DOCUMENT_LEVEL_CORE",
    "excluded_fields": {
      "unit_specific_amounts": "NOT_LABELED_UNIT_REQUIRED",
      "additional_costs": "NOT_LABELED_UNIT_REQUIRED",
      "bank_names": "NOT_LABELED_EXPLICIT_LOAN_BANK_REQUIRED",
      "guarantee_provider": "NOT_LABELED_EXPLICIT_PROVIDER_REQUIRED"
    },
    "notes": [
      "Visual review confirmed not safely stated: the arranged-loan percentage is not explicitly provided in the full loan-guidance section."
    ]
  },
  "labels": {
    "payment_schedule": {
      "down_payment_ratio": {
        "value": 0.1,
        "verification": "VERIFIED_TEXT",
        "evidence": [
          {
            "page": 7,
            "raw_text": "계약금 (10%) 중도금 (60%) 잔금 (30%)"
          }
        ]
      },
      "interim_payment_ratio": {
        "value": 0.6,
        "verification": "VERIFIED_TEXT",
        "evidence": [
          {
            "page": 7,
            "raw_text": "계약금 (10%) 중도금 (60%) 잔금 (30%)"
          }
        ]
      },
      "balance_payment_ratio": {
        "value": 0.3,
        "verification": "VERIFIED_TEXT",
        "evidence": [
          {
            "page": 7,
            "raw_text": "계약금 (10%) 중도금 (60%) 잔금 (30%)"
          }
        ]
      },
      "interim_installments": {
        "value": [
          {
            "number": 1,
            "ratio": 0.1,
            "due_date": "2027-03-10"
          },
          {
            "number": 2,
            "ratio": 0.1,
            "due_date": "2027-08-10"
          },
          {
            "number": 3,
            "ratio": 0.1,
            "due_date": "2028-01-10"
          },
          {
            "number": 4,
            "ratio": 0.1,
            "due_date": "2028-04-10"
          },
          {
            "number": 5,
            "ratio": 0.1,
            "due_date": "2028-07-10"
          },
          {
            "number": 6,
            "ratio": 0.1,
            "due_date": "2028-10-10"
          }
        ],
        "verification": "VERIFIED_NORMALIZED",
        "evidence": [
          {
            "page": 7,
            "raw_text": "2027.03.10"
          },
          {
            "page": 7,
            "raw_text": "2027.08.10."
          },
          {
            "page": 7,
            "raw_text": "2028.01.10."
          },
          {
            "page": 7,
            "raw_text": "2028.04.10."
          },
          {
            "page": 7,
            "raw_text": "2028.07.10"
          },
          {
            "page": 7,
            "raw_text": "2028.10.10"
          }
        ]
      },
      "balance_due_text": {
        "value": "입주지정일",
        "verification": "VERIFIED_NORMALIZED",
        "evidence": [
          {
            "page": 7,
            "raw_text": "입주지정일"
          }
        ]
      },
      "move_in_month": {
        "value": "2029-01",
        "verification": "VERIFIED_NORMALIZED",
        "evidence": [
          {
            "page": 6,
            "raw_text": "입주시기 : 2029년 01월 예정"
          }
        ]
      }
    },
    "interim_loan": {
      "arrangement_status": {
        "value": "PLANNED",
        "verification": "VERIFIED_NORMALIZED",
        "evidence": [
          {
            "page": 42,
            "raw_text": "중도금 대출을 알선을 제공할 예정"
          }
        ]
      },
      "arranged_ratio": {
        "value": null,
        "verification": "VERIFIED_NOT_STATED",
        "evidence": []
      },
      "self_funding_ratio": {
        "value": null,
        "verification": "VERIFIED_NOT_STATED",
        "evidence": []
      },
      "interest_type": {
        "value": "DEFERRED_INTEREST",
        "verification": "VERIFIED_NORMALIZED",
        "evidence": [
          {
            "page": 42,
            "raw_text": "중도금 이자후불제 조건"
          }
        ]
      },
      "prepay_requirement_ratio": {
        "value": 0.1,
        "verification": "VERIFIED_DERIVED",
        "evidence": [
          {
            "page": 43,
            "raw_text": "계약금 완납 이 후 중도금 대출이 가능"
          },
          {
            "page": 7,
            "raw_text": "계약금 (10%) 중도금 (60%) 잔금 (30%)"
          }
        ]
      }
    }
  }
}
