{
  "schema_version": "core_reference_v0.1",
  "complex_id": "2026000354",
  "source": {
    "pdf_filename": "2026000354_4.pdf",
    "text_filename": "2026000354_4.txt",
    "pdf_sha256": "b52cded6e374f1ec024887bd1c70a328d313df8e782323d128bf1e7925d4c520",
    "page_count": 79
  },
  "review": {
    "text_source_review": "COMPLETE",
    "pdf_visual_review": "COMPLETE",
    "scope": "DOCUMENT_LEVEL_CORE",
    "excluded_fields": {
      "unit_specific_amounts": "NOT_LABELED_UNIT_REQUIRED",
      "additional_costs": "NOT_LABELED_UNIT_REQUIRED",
      "bank_names": "NOT_LABELED_EXPLICIT_LOAN_BANK_REQUIRED",
      "guarantee_provider": "NOT_LABELED_EXPLICIT_PROVIDER_REQUIRED"
    },
    "notes": []
  },
  "labels": {
    "payment_schedule": {
      "down_payment_ratio": {
        "value": 0.05,
        "verification": "VERIFIED_TEXT",
        "evidence": [
          {
            "page": 7,
            "raw_text": "계약금(5%) 중도금(60%) 잔금(35%)"
          }
        ]
      },
      "interim_payment_ratio": {
        "value": 0.6,
        "verification": "VERIFIED_TEXT",
        "evidence": [
          {
            "page": 7,
            "raw_text": "계약금(5%) 중도금(60%) 잔금(35%)"
          }
        ]
      },
      "balance_payment_ratio": {
        "value": 0.35,
        "verification": "VERIFIED_TEXT",
        "evidence": [
          {
            "page": 7,
            "raw_text": "계약금(5%) 중도금(60%) 잔금(35%)"
          }
        ]
      },
      "interim_installments": {
        "value": [
          {
            "number": 1,
            "ratio": 0.1,
            "due_date": "2027-10-28"
          },
          {
            "number": 2,
            "ratio": 0.1,
            "due_date": "2028-04-25"
          },
          {
            "number": 3,
            "ratio": 0.1,
            "due_date": "2029-01-23"
          },
          {
            "number": 4,
            "ratio": 0.1,
            "due_date": "2030-01-31"
          },
          {
            "number": 5,
            "ratio": 0.1,
            "due_date": "2030-07-23"
          },
          {
            "number": 6,
            "ratio": 0.1,
            "due_date": "2031-04-22"
          }
        ],
        "verification": "VERIFIED_NORMALIZED",
        "evidence": [
          {
            "page": 7,
            "raw_text": "2027.10.28"
          },
          {
            "page": 7,
            "raw_text": "2028.04.25"
          },
          {
            "page": 7,
            "raw_text": "2029.01.23"
          },
          {
            "page": 7,
            "raw_text": "2030.01.31"
          },
          {
            "page": 7,
            "raw_text": "2030.07.23"
          },
          {
            "page": 7,
            "raw_text": "2031.04.22"
          }
        ]
      },
      "balance_due_text": {
        "value": "입주지정일",
        "verification": "VERIFIED_NORMALIZED",
        "evidence": [
          {
            "page": 7,
            "raw_text": "입주지정일"
          }
        ]
      },
      "move_in_month": {
        "value": "2032-03",
        "verification": "VERIFIED_NORMALIZED",
        "evidence": [
          {
            "page": 5,
            "raw_text": "입주시기 : 2032년 03월 예정"
          }
        ]
      }
    },
    "interim_loan": {
      "arrangement_status": {
        "value": "PLANNED",
        "verification": "VERIFIED_NORMALIZED",
        "evidence": [
          {
            "page": 40,
            "raw_text": "융자 알선을 시행할 예정"
          }
        ]
      },
      "arranged_ratio": {
        "value": 0.6,
        "verification": "VERIFIED_TEXT",
        "evidence": [
          {
            "page": 40,
            "raw_text": "총 분양대금의 60% 범위 내에서"
          }
        ]
      },
      "self_funding_ratio": {
        "value": 0,
        "verification": "VERIFIED_DERIVED",
        "evidence": [
          {
            "page": 7,
            "raw_text": "계약금(5%) 중도금(60%) 잔금(35%)"
          },
          {
            "page": 40,
            "raw_text": "총 분양대금의 60% 범위 내에서"
          }
        ]
      },
      "interest_type": {
        "value": "DEFERRED_INTEREST",
        "verification": "VERIFIED_NORMALIZED",
        "evidence": [
          {
            "page": 40,
            "raw_text": "이자후불제"
          }
        ]
      },
      "prepay_requirement_ratio": {
        "value": 0.05,
        "verification": "VERIFIED_TEXT",
        "evidence": [
          {
            "page": 10,
            "raw_text": "분양대금의 총 5% 완납 후"
          }
        ]
      }
    }
  }
}
