{
  "schema_version": "core_reference_v0.1",
  "complex_id": "2026000316",
  "source": {
    "pdf_filename": "2026000316_3.pdf",
    "text_filename": "2026000316_3.txt",
    "pdf_sha256": "0d0abe61cbc0e21de5264309548607e8d4563f1dfa216c839ef25bba415c9e0d",
    "page_count": 63
  },
  "review": {
    "text_source_review": "COMPLETE",
    "pdf_visual_review": "COMPLETE",
    "scope": "DOCUMENT_LEVEL_CORE",
    "excluded_fields": {
      "unit_specific_amounts": "NOT_LABELED_UNIT_REQUIRED",
      "additional_costs": "NOT_LABELED_UNIT_REQUIRED",
      "bank_names": "NOT_LABELED_EXPLICIT_LOAN_BANK_REQUIRED",
      "guarantee_provider": "NOT_LABELED_EXPLICIT_PROVIDER_REQUIRED"
    },
    "notes": []
  },
  "labels": {
    "payment_schedule": {
      "down_payment_ratio": {
        "value": 0.1,
        "verification": "VERIFIED_TEXT",
        "evidence": [
          {
            "page": 7,
            "raw_text": "계약금(10%) 중도금(60%) 잔금(30%)"
          }
        ]
      },
      "interim_payment_ratio": {
        "value": 0.6,
        "verification": "VERIFIED_TEXT",
        "evidence": [
          {
            "page": 7,
            "raw_text": "계약금(10%) 중도금(60%) 잔금(30%)"
          }
        ]
      },
      "balance_payment_ratio": {
        "value": 0.3,
        "verification": "VERIFIED_TEXT",
        "evidence": [
          {
            "page": 7,
            "raw_text": "계약금(10%) 중도금(60%) 잔금(30%)"
          }
        ]
      },
      "interim_installments": {
        "value": [
          {
            "number": 1,
            "ratio": 0.1,
            "due_date": "2027-03-10"
          },
          {
            "number": 2,
            "ratio": 0.1,
            "due_date": "2027-08-10"
          },
          {
            "number": 3,
            "ratio": 0.1,
            "due_date": "2028-02-10"
          },
          {
            "number": 4,
            "ratio": 0.1,
            "due_date": "2028-09-11"
          },
          {
            "number": 5,
            "ratio": 0.1,
            "due_date": "2029-01-10"
          },
          {
            "number": 6,
            "ratio": 0.1,
            "due_date": "2029-05-10"
          }
        ],
        "verification": "VERIFIED_NORMALIZED",
        "evidence": [
          {
            "page": 7,
            "raw_text": "2027.03.10"
          },
          {
            "page": 7,
            "raw_text": "2027.08.10"
          },
          {
            "page": 7,
            "raw_text": "2028.02.10"
          },
          {
            "page": 7,
            "raw_text": "2028.09.11"
          },
          {
            "page": 7,
            "raw_text": "2029.01.10"
          },
          {
            "page": 7,
            "raw_text": "2029.05.10"
          }
        ]
      },
      "balance_due_text": {
        "value": "입주지정기간",
        "verification": "VERIFIED_NORMALIZED",
        "evidence": [
          {
            "page": 7,
            "raw_text": "입주지정기간"
          }
        ]
      },
      "move_in_month": {
        "value": "2029-09",
        "verification": "VERIFIED_NORMALIZED",
        "evidence": [
          {
            "page": 6,
            "raw_text": "입주시기 : 2029년 09월 예정"
          }
        ]
      }
    },
    "interim_loan": {
      "arrangement_status": {
        "value": "PLANNED",
        "verification": "VERIFIED_NORMALIZED",
        "evidence": [
          {
            "page": 36,
            "raw_text": "융자 알선을 시행할 예정"
          }
        ]
      },
      "arranged_ratio": {
        "value": 0.6,
        "verification": "VERIFIED_TEXT",
        "evidence": [
          {
            "page": 36,
            "raw_text": "총 공급대금의 60% 범위 내에서"
          }
        ]
      },
      "self_funding_ratio": {
        "value": 0,
        "verification": "VERIFIED_DERIVED",
        "evidence": [
          {
            "page": 7,
            "raw_text": "계약금(10%) 중도금(60%) 잔금(30%)"
          },
          {
            "page": 36,
            "raw_text": "총 공급대금의 60% 범위 내에서"
          }
        ]
      },
      "interest_type": {
        "value": "DEFERRED_INTEREST",
        "verification": "VERIFIED_NORMALIZED",
        "evidence": [
          {
            "page": 36,
            "raw_text": "중도금 대출 이자후불제"
          }
        ]
      },
      "prepay_requirement_ratio": {
        "value": 0.1,
        "verification": "VERIFIED_TEXT",
        "evidence": [
          {
            "page": 36,
            "raw_text": "분양대금의 10%(1차, 2차 계약금) 완납 이후"
          }
        ]
      }
    }
  }
}
