{
  "schema_version": "core_reference_v0.1",
  "complex_id": "2026000355",
  "source": {
    "pdf_filename": "2026000355_6.pdf",
    "text_filename": "2026000355_6.txt",
    "pdf_sha256": "377c2ebcf0c6ec451c741825a522da16fd79f1e76618b9c6b7074291004d8427",
    "page_count": 61
  },
  "review": {
    "text_source_review": "COMPLETE",
    "pdf_visual_review": "COMPLETE",
    "scope": "DOCUMENT_LEVEL_CORE",
    "excluded_fields": {
      "unit_specific_amounts": "NOT_LABELED_UNIT_REQUIRED",
      "additional_costs": "NOT_LABELED_UNIT_REQUIRED",
      "bank_names": "NOT_LABELED_EXPLICIT_LOAN_BANK_REQUIRED",
      "guarantee_provider": "NOT_LABELED_EXPLICIT_PROVIDER_REQUIRED"
    },
    "notes": []
  },
  "labels": {
    "payment_schedule": {
      "down_payment_ratio": {
        "value": 0.1,
        "verification": "VERIFIED_TEXT",
        "evidence": [
          {
            "page": 9,
            "raw_text": "계약금"
          },
          {
            "page": 9,
            "raw_text": "(10%)"
          }
        ]
      },
      "interim_payment_ratio": {
        "value": 0.6,
        "verification": "VERIFIED_TEXT",
        "evidence": [
          {
            "page": 9,
            "raw_text": "중도금(60%)"
          }
        ]
      },
      "balance_payment_ratio": {
        "value": 0.3,
        "verification": "VERIFIED_TEXT",
        "evidence": [
          {
            "page": 9,
            "raw_text": "잔금(30%)"
          }
        ]
      },
      "interim_installments": {
        "value": [
          {
            "number": 1,
            "ratio": 0.1,
            "due_date": "2027-01-30"
          },
          {
            "number": 2,
            "ratio": 0.1,
            "due_date": "2027-05-31"
          },
          {
            "number": 3,
            "ratio": 0.1,
            "due_date": "2027-10-29"
          },
          {
            "number": 4,
            "ratio": 0.1,
            "due_date": "2028-03-30"
          },
          {
            "number": 5,
            "ratio": 0.1,
            "due_date": "2028-08-30"
          },
          {
            "number": 6,
            "ratio": 0.1,
            "due_date": "2029-01-30"
          }
        ],
        "verification": "VERIFIED_NORMALIZED",
        "evidence": [
          {
            "page": 9,
            "raw_text": "2027.01.30."
          },
          {
            "page": 9,
            "raw_text": "2027.05.31."
          },
          {
            "page": 9,
            "raw_text": "2027.10.29."
          },
          {
            "page": 9,
            "raw_text": "2028.03.30."
          },
          {
            "page": 9,
            "raw_text": "2028.08.30."
          },
          {
            "page": 9,
            "raw_text": "2029.01.30."
          }
        ]
      },
      "balance_due_text": {
        "value": "입주지정일",
        "verification": "VERIFIED_NORMALIZED",
        "evidence": [
          {
            "page": 9,
            "raw_text": "지정일"
          }
        ]
      },
      "move_in_month": {
        "value": "2029-05",
        "verification": "VERIFIED_NORMALIZED",
        "evidence": [
          {
            "page": 7,
            "raw_text": "입주시기 : 2029년 05월 예정"
          }
        ]
      }
    },
    "interim_loan": {
      "arrangement_status": {
        "value": "PLANNED",
        "verification": "VERIFIED_NORMALIZED",
        "evidence": [
          {
            "page": 38,
            "raw_text": "중도금 융자 알선을 시행할 예정"
          }
        ]
      },
      "arranged_ratio": {
        "value": 0.4,
        "verification": "VERIFIED_TEXT",
        "evidence": [
          {
            "page": 38,
            "raw_text": "전체 분양대금의 40% 범위 내에서"
          }
        ]
      },
      "self_funding_ratio": {
        "value": 0.2,
        "verification": "VERIFIED_DERIVED",
        "evidence": [
          {
            "page": 38,
            "raw_text": "5~6회차 중도금(분양대금의 20%)은 계약자가 직접 납부"
          }
        ]
      },
      "interest_type": {
        "value": "DEFERRED_INTEREST",
        "verification": "VERIFIED_NORMALIZED",
        "evidence": [
          {
            "page": 38,
            "raw_text": "중도금 대출은 이자후불제"
          }
        ]
      },
      "prepay_requirement_ratio": {
        "value": 0.1,
        "verification": "VERIFIED_TEXT",
        "evidence": [
          {
            "page": 38,
            "raw_text": "계약금(분양대금의 10%) 완납"
          }
        ]
      }
    }
  }
}
