{
  "schema_version": "core_reference_v0.1",
  "complex_id": "2026000383",
  "source": {
    "pdf_filename": "2026000383_1.pdf",
    "text_filename": "2026000383_1.txt",
    "pdf_sha256": "4464ac6ae6059ce324d15c51a5c6bb5cd00ad7e63614531f2a3483186a5f710e",
    "page_count": 78
  },
  "review": {
    "text_source_review": "COMPLETE",
    "pdf_visual_review": "COMPLETE",
    "scope": "DOCUMENT_LEVEL_CORE",
    "excluded_fields": {
      "unit_specific_amounts": "NOT_LABELED_UNIT_REQUIRED",
      "additional_costs": "NOT_LABELED_UNIT_REQUIRED",
      "bank_names": "NOT_LABELED_EXPLICIT_LOAN_BANK_REQUIRED",
      "guarantee_provider": "NOT_LABELED_EXPLICIT_PROVIDER_REQUIRED"
    },
    "notes": []
  },
  "labels": {
    "payment_schedule": {
      "down_payment_ratio": {
        "value": 0.05,
        "verification": "VERIFIED_TEXT",
        "evidence": [
          {
            "page": 8,
            "raw_text": "계약금(5%) 중도금(60%) 잔금(35%)"
          }
        ]
      },
      "interim_payment_ratio": {
        "value": 0.6,
        "verification": "VERIFIED_TEXT",
        "evidence": [
          {
            "page": 8,
            "raw_text": "계약금(5%) 중도금(60%) 잔금(35%)"
          }
        ]
      },
      "balance_payment_ratio": {
        "value": 0.35,
        "verification": "VERIFIED_TEXT",
        "evidence": [
          {
            "page": 8,
            "raw_text": "계약금(5%) 중도금(60%) 잔금(35%)"
          }
        ]
      },
      "interim_installments": {
        "value": [
          {
            "number": 1,
            "ratio": 0.1,
            "due_date": "2026-12-10"
          },
          {
            "number": 2,
            "ratio": 0.1,
            "due_date": "2027-04-12"
          },
          {
            "number": 3,
            "ratio": 0.1,
            "due_date": "2027-09-10"
          },
          {
            "number": 4,
            "ratio": 0.1,
            "due_date": "2028-05-10"
          },
          {
            "number": 5,
            "ratio": 0.1,
            "due_date": "2028-10-10"
          },
          {
            "number": 6,
            "ratio": 0.1,
            "due_date": "2029-03-12"
          }
        ],
        "verification": "VERIFIED_NORMALIZED",
        "evidence": [
          {
            "page": 8,
            "raw_text": "2026-12-10"
          },
          {
            "page": 8,
            "raw_text": "2027-04-12"
          },
          {
            "page": 8,
            "raw_text": "2027-09-10"
          },
          {
            "page": 8,
            "raw_text": "2028-05-10"
          },
          {
            "page": 8,
            "raw_text": "2028-10-10"
          },
          {
            "page": 8,
            "raw_text": "2029-03-12"
          }
        ]
      },
      "balance_due_text": {
        "value": "입주지정기간 만료일 또는 실입주일 중 빠른 날",
        "verification": "VERIFIED_NORMALIZED",
        "evidence": [
          {
            "page": 8,
            "raw_text": "입주지정기간"
          },
          {
            "page": 8,
            "raw_text": "실입주일 중"
          },
          {
            "page": 8,
            "raw_text": "빠른 날"
          }
        ]
      },
      "move_in_month": {
        "value": "2029-09",
        "verification": "VERIFIED_NORMALIZED",
        "evidence": [
          {
            "page": 6,
            "raw_text": "입주시기 : 2029년 09월 예정"
          }
        ]
      }
    },
    "interim_loan": {
      "arrangement_status": {
        "value": "PLANNED",
        "verification": "VERIFIED_NORMALIZED",
        "evidence": [
          {
            "page": 38,
            "raw_text": "중도금 융자알선을 시행할 예정"
          }
        ]
      },
      "arranged_ratio": {
        "value": 0.6,
        "verification": "VERIFIED_TEXT",
        "evidence": [
          {
            "page": 38,
            "raw_text": "총 공급대금의 60% 범위 내에서"
          }
        ]
      },
      "self_funding_ratio": {
        "value": 0,
        "verification": "VERIFIED_DERIVED",
        "evidence": [
          {
            "page": 8,
            "raw_text": "계약금(5%) 중도금(60%) 잔금(35%)"
          },
          {
            "page": 38,
            "raw_text": "총 공급대금의 60% 범위 내에서"
          }
        ]
      },
      "interest_type": {
        "value": "DEFERRED_INTEREST",
        "verification": "VERIFIED_NORMALIZED",
        "evidence": [
          {
            "page": 38,
            "raw_text": "중도금 이자후불제"
          }
        ]
      },
      "prepay_requirement_ratio": {
        "value": 0.05,
        "verification": "VERIFIED_TEXT",
        "evidence": [
          {
            "page": 38,
            "raw_text": "공급대금의 5% 이상 납부 이후"
          }
        ]
      }
    }
  }
}
