{
  "schema_version": "core_reference_v0.1",
  "complex_id": "2026000327",
  "source": {
    "pdf_filename": "2026000327_3.pdf",
    "text_filename": "2026000327_3.txt",
    "pdf_sha256": "e67ea1355530fe737a1974496b9954fa33ece4e51043795f610c570c0adb0b70",
    "page_count": 36
  },
  "review": {
    "text_source_review": "COMPLETE",
    "pdf_visual_review": "COMPLETE",
    "scope": "DOCUMENT_LEVEL_CORE",
    "excluded_fields": {
      "unit_specific_amounts": "NOT_LABELED_UNIT_REQUIRED",
      "additional_costs": "NOT_LABELED_UNIT_REQUIRED",
      "bank_names": "NOT_LABELED_EXPLICIT_LOAN_BANK_REQUIRED",
      "guarantee_provider": "NOT_LABELED_EXPLICIT_PROVIDER_REQUIRED"
    },
    "notes": [
      "The source table prints 2026-09-30 for all six interim installments; preserved verbatim.",
      "Payment table was visually checked against PDF page 6."
    ]
  },
  "labels": {
    "payment_schedule": {
      "down_payment_ratio": {
        "value": 0.1,
        "verification": "VERIFIED_TEXT",
        "evidence": [
          {
            "page": 6,
            "raw_text": "계약금(10%) 중도금(60%) 잔 금(30%)"
          }
        ]
      },
      "interim_payment_ratio": {
        "value": 0.6,
        "verification": "VERIFIED_TEXT",
        "evidence": [
          {
            "page": 6,
            "raw_text": "계약금(10%) 중도금(60%) 잔 금(30%)"
          }
        ]
      },
      "balance_payment_ratio": {
        "value": 0.3,
        "verification": "VERIFIED_TEXT",
        "evidence": [
          {
            "page": 6,
            "raw_text": "계약금(10%) 중도금(60%) 잔 금(30%)"
          }
        ]
      },
      "interim_installments": {
        "value": [
          {
            "number": 1,
            "ratio": 0.1,
            "due_date": "2026-09-30"
          },
          {
            "number": 2,
            "ratio": 0.1,
            "due_date": "2026-09-30"
          },
          {
            "number": 3,
            "ratio": 0.1,
            "due_date": "2026-09-30"
          },
          {
            "number": 4,
            "ratio": 0.1,
            "due_date": "2026-09-30"
          },
          {
            "number": 5,
            "ratio": 0.1,
            "due_date": "2026-09-30"
          },
          {
            "number": 6,
            "ratio": 0.1,
            "due_date": "2026-09-30"
          }
        ],
        "verification": "VERIFIED_NORMALIZED",
        "evidence": [
          {
            "page": 6,
            "raw_text": "2026.09.30."
          },
          {
            "page": 6,
            "raw_text": "2026.09.30."
          },
          {
            "page": 6,
            "raw_text": "2026.09.30."
          },
          {
            "page": 6,
            "raw_text": "2026.09.30."
          },
          {
            "page": 6,
            "raw_text": "2026.09.30."
          },
          {
            "page": 6,
            "raw_text": "2026.09.30."
          }
        ]
      },
      "balance_due_text": {
        "value": "입주지정일",
        "verification": "VERIFIED_NORMALIZED",
        "evidence": [
          {
            "page": 6,
            "raw_text": "입주지정일"
          }
        ]
      },
      "move_in_month": {
        "value": "2027-03",
        "verification": "VERIFIED_NORMALIZED",
        "evidence": [
          {
            "page": 5,
            "raw_text": "입주시기 : 2027년 03월 예정"
          }
        ]
      }
    },
    "interim_loan": {
      "arrangement_status": {
        "value": "PLANNED",
        "verification": "VERIFIED_NORMALIZED",
        "evidence": [
          {
            "page": 21,
            "raw_text": "이자후불제 조건으로 중도금대출을 알선할 수 있으며"
          }
        ]
      },
      "arranged_ratio": {
        "value": 0.6,
        "verification": "VERIFIED_TEXT",
        "evidence": [
          {
            "page": 21,
            "raw_text": "중도금(1~6회차 중도금)(공급대금의 60%)"
          }
        ]
      },
      "self_funding_ratio": {
        "value": 0,
        "verification": "VERIFIED_DERIVED",
        "evidence": [
          {
            "page": 6,
            "raw_text": "계약금(10%) 중도금(60%) 잔 금(30%)"
          },
          {
            "page": 21,
            "raw_text": "중도금(1~6회차 중도금)(공급대금의 60%)"
          }
        ]
      },
      "interest_type": {
        "value": "DEFERRED_INTEREST",
        "verification": "VERIFIED_NORMALIZED",
        "evidence": [
          {
            "page": 21,
            "raw_text": "이자후불제 조건"
          }
        ]
      },
      "prepay_requirement_ratio": {
        "value": 0.05,
        "verification": "VERIFIED_TEXT",
        "evidence": [
          {
            "page": 21,
            "raw_text": "계약금(공급대금의 5%) 완납이후"
          }
        ]
      }
    }
  }
}
